text_id,text,label,metadata__party,metadata__year,metadata__split
570,We will prioritize Divyang beneficiaries under Pradhan Mantri Awas Yojana and mandate accessibility benchmarks to be met in Pradhan Mantri Awas Yojana .,no pledge,BJP,2019,trn
728,The Indian National Congress has always given the highest priority to internal security .,no pledge,INC,2014,trn
584,"4 . We are mindful of the fact that while we have worked to increase access to electricity, its availability remains an area of concern .",no pledge,INC,2014,trn
545,10 . The policies to encourage foreign direct investment pursued by the Congress - led UPA Government ensured that India remained amongst the top 3 investment destinations globally .,no pledge,INC,2014,trn
253,"Women and senior citizens will receive an additional exemption benefit of Rs 50,000 .",pledge,BJP,2009,trn
210,"Through a combination of remunerative prices, lower input costs, and assured access to institutional credit, we will set our Kisans on the path to “Karz Mukti,” or Freedom from Indebtedness .",no pledge,INC,2019,trn
378,Prosecution under DTC and GST 2 . 0 will be only in cases of criminal conspiracy or corruption or fraud .,pledge,INC,2019,trn
27,The country has been dragged through 10 years of Jobless Growth by the Congress - led UPA Government .,no pledge,BJP,2014,trn
43,"We do not respond by subverting democratic institutions and blocking Parliament session after session, year after year .",no pledge,INC,2014,trn
168,11 . We will strengthen the legal and institutional framework to protect our children .,no pledge,INC,2014,trn
982,"Also, We will expand and empower our pool of diplomats, ensuring our message is taken to the world and our great nation represented on the whole in a befitting manner .",pledge,BJP,2014,trn
488,"We will also stay focused on providing all possible support for our farmers, in particular women and small and marginal farmers .",no pledge,INC,2014,trn
286,The physical infrastructure facilities will be that of urban areas but the heart and soul will be of rural areas .,no pledge,BJP,2009,trn
286,We will double the length of National Highways by 2022 .,pledge,BJP,2019,trn
450,Launch a National Digital Highway Development Project to bring affordable broadband Internet connectivity to every village .,pledge,BJP,2009,trn
345,The scheme will be funded through new revenues and rationalisation of expenditure .,no pledge,INC,2019,trn
506,"Remove all remaining gender disparities in property rights, marital rights and cohabitation rights .",no pledge,BJP,2009,trn
98,The Indian National Congress led the charge to enact a unique and unprecedented law to safeguard food security for the poorest .,no pledge,INC,2014,trn
38,Congress ushered in the Green Revolution and the White Revolution that transformed lives in rural India .,no pledge,INC,2019,trn
696,Different systems will be synergized in the delivery of healthcare and in medical education .,no pledge,BJP,2004,trn
575,"Renewable sources of energy have special significance for India, particularly in specific regions .",no pledge,INC,1999,trn
186,Recommendations of the newly - established National Cattle Commission will be implemented .,no pledge,BJP,2004,trn
2,"In the next five years, we promise to create growth opportunities for all citizens in every aspect of life .",no pledge,BJP,2019,trn
427,"The people of our country have, time and again, placed their trust and confidence in the Indian National Congress .",no pledge,INC,2009,trn
903,We promise to restore the 200 - point roster system for appointments to central universities and other central institutes of higher learning .,pledge,INC,2019,trn
322,"Congress is conscious that while much has been achieved since liberalisation in 1991, there is much more to be done .",no pledge,INC,2019,trn
643,The purpose of law is regulation in order to strengthen freedom .,no pledge,INC,2019,trn
186,"While organised sector employment must expand, the reality is that employment in the unorganised sector contributes close to 94% of India’s labour force .",no pledge,INC,2014,trn
503,A National Policy for promotion of the Informal Sector will be unveiled before the end of 2004 .,pledge,BJP,2004,trn
185,We will restrict foreign equity holding in private television broadcasting to 20% (and prevent cross holding to avoid emergence of monopolies in the media) .,pledge,BJP,1999,trn
134,"We will bring one crore hectares agricultural land under micro - irrigation, this would be supplemented with ‘fertigation’ to promote judicious use of fertilizers .",pledge,BJP,2019,trn
719,Safety and Security of tourists would be accorded due priority .,no pledge,BJP,2014,trn
140,Good performers amongst the Panchayats will be rewarded with additional developmental grants .,pledge,BJP,2014,trn
569,6 . The Indian National Congress will ensure adequate funding and timely development of Regional Rapid Transit Systems .,no pledge,INC,2014,trn
734,2 . We will ensure that our police forces are fully equipped with the modern weapons and technology .,no pledge,INC,2014,trn
877,Congress promises to attach the highest importance to learning outcomes .,no pledge,INC,2019,trn
721,A strategy will be developed for disposing of long delayed cases .,no pledge,INC,2014,trn
53,The Congress Party has been a central part of Indian life for the past 114 years .,no pledge,INC,1999,trn
463,We have already identified learning outcomes for various classes and our priority in the next five years will be to ensure that children achieve these learning outcomes .,no pledge,BJP,2019,trn
167,"This growth will come from agriculture, industry and other sectors .",no pledge,INC,1999,trn
883,Broaden and deepen our multi - dimensional relations with USA .,no pledge,BJP,2004,trn
144,We will also introduce a multi - purpose identity card for all citizens .,pledge,BJP,1999,trn
642,"Spread of education among SCs, STs, OBCs, and minorities, and activities aimed at removing gender disparities in education at all levels, will receive increased support .",no pledge,BJP,2004,trn
217,We will completely re - design the BJP government’s failed Fasal Bima Yojana (Crop Insurance Scheme) that has only enriched the insurance companies at the cost of the farmers .,pledge,INC,2019,trn
266,"Apart from reducing election expenses for both political parties and Government, this will ensure certain stability for State Governments .",no pledge,BJP,2014,trn
335,lt has always advocated formal and informal talks on the basis of the historic Shimla Agreement of 1972 .,no pledge,INC,2004,trn
630,The Indian National Congress is committed to providing clean cooking fuel across the country in an accelerated manner in order to address this .,no pledge,INC,2014,trn
347,India's public health problems are largely hygiene and sanitation - linked .,no pledge,INC,1999,trn
129,There are about 4500 MPs and MLAs representing a population of 95 crore .,no pledge,INC,1999,trn
861,Every effort will be made to set up Human Rights Commissions in every state .,pledge,INC,1999,trn
62,Government and industry must work together to achieve key objectives aimed at enhancing the dynamism of the market with effective and efficient regulatory mechanisms .,no pledge,BJP,1999,trn
305,"Appropriate social security measures will be devised to protect the workers in the unorganized sector against the risks of ill - health, unemployment and old age .",pledge,INC,2004,trn
505,Mid - day meal scheme would be revitalized in terms of management and delivery .,no pledge,BJP,2014,trn
307,We will endeavor to bring every Fortune 500 company to set up a business in India .,no pledge,INC,2019,trn
420,"The Congress commits itself to constitute a Commission to examine, consistent with the relevant provision of the Constitution relating to the minorities, the question of the backwardness of the minorities .",pledge,INC,1999,trn
268,"The Indian National Congress has pioneered reservations for minorities in Kerala, Karnataka and Andhra Pradesh in government employment and education on the basis of their social and economic backwardness .",no pledge,INC,2009,trn
871,"Because of the lethargic and careless approach, many gallant young men became martyrs trying to recover our own territory in and around Kargil .",no pledge,INC,1999,trn
312,We will give special focus to the small entrepreneur and to small and medium enterprises .,no pledge,INC,2009,trn
190,"This includes not just software and IT - enabled services, not just trade, distribution and transport, not just financial and telecommunications services but also tourism .",no pledge,INC,2004,trn
134,The BJP will restore the balance that has been disturbed by the UPA Government .,no pledge,BJP,2009,trn
14,"It has sought to gloss over the increasing cost of food, which is eight per cent higher than in 2008, and many times more than in 2004, by projecting misleading statistics .",no pledge,BJP,2009,trn
203,"A stable, long - term policy on exports of agricultural products and commodities wiII be adopted .",no pledge,INC,1999,trn
657,A Group of Experts will be set up to formulate target - driven objectives towards this end .,no pledge,BJP,2009,trn
461,"Strict implementation of laws related to women, particularly those related to rape .",no pledge,BJP,2014,trn
32,"On the other hand, under the BJP government, every independent institution has suffered an unprecedented loss of credibility .",no pledge,INC,2019,trn
49,We will lay emphasis on empowerment through excellence by providing quality education .,no pledge,BJP,2009,trn
163,"At this crucial juncture of our history, the most urgent task is to have a government in New Delhi that will last the full five years .",no pledge,INC,1999,trn
590,"As we build ‘New India’, we intend to actively invest in strengthening our cultural roots and preserving civilizational continuity .",no pledge,BJP,2019,trn
606,"A Minorities Development Agenda will be unveiled within the first six months to focus on a 3 - E program : Education, Economic upliftment, and Empowerment .",pledge,BJP,2004,trn
42,The Indian National Congress’s secular and liberal nationalism is founded on a celebration of India’s many diversities .,no pledge,INC,2009,trn
63,"As past experience has shown, the Third Front is a recipe for political instability .",no pledge,INC,2009,trn
5,This was supposed to be a Government that would work for the welfare of the ‘aam admi’ – the common man .,no pledge,BJP,2009,trn
640,Appropriate resources both from Government and non - government sources will be mobilized to match our ambitious goals .,no pledge,BJP,2004,trn
64,"It is about better society, about improving the way citizens can demand and obtain all sorts of public goods .",no pledge,BJP,1999,trn
965,"The manifesto is a charter, a compact that a political party enters into with the people it serves .",no pledge,INC,1999,trn
129,India is a country of immense diversity - a highly decentralized federal structure is thus crucial in meeting the varied ideas and aspirations of our diverse people .,no pledge,BJP,2014,trn
676,Congress firmly believes that the media must be free and self - regulated .,no pledge,INC,2019,trn
306,7 . There has been a reduction of new HIV infections in the country by 57% .,no pledge,INC,2014,trn
715,Congress pioneered the women’s self - help group (SHG) movement that today boasts of 87 lakh groups .,no pledge,INC,2019,trn
551,The unprecedented success of the Jan Dhan Yojana has dramatically improved financial inclusion in India .,no pledge,BJP,2019,trn
408,The Indian National Congress has been unequivocal in its emphasis and support for providing affordable and quality education .,no pledge,INC,2014,trn
362,Commercial exploitation of discovered gas fields will begin by 2005 .,pledge,BJP,2004,trn
24,We have delivered prosperity for the people of India before .,no pledge,INC,2019,trn
389,We will also ensure implementation of the 14th Finance Commission’s recommendations .,no pledge,BJP,2019,trn
107,"India will engage with the world in the global war on terror while not compromising on its domestic interests, primarily protecting citizens from the ravages of terrorism .",no pledge,BJP,2009,trn
778,Modernize and equip all stations with requisite infrastructure and public utilities .,no pledge,BJP,2014,trn
23,"Last year, our efficient and effective management, of severe drought situation in fourteen States, was without precedent .",no pledge,BJP,2004,trn
351,This is a scheme that will receive the highest priority .,pledge,INC,1999,trn
432,"we will initiate the 'Young Leaders programme' in all sectors, to recognize, reward and involve these exceptionally talented youth to serve as role models and mentors for others .",pledge,BJP,2014,trn
771,"This will be done in a planned manner focusing on national development, rather than political exigency .",no pledge,BJP,2014,trn
79,The misuse of any religion to spread hate and discord in our society Is communalism .,no pledge,INC,2004,trn
354,The Indian National Congress has periodically renewed itself by inducting young men and women into the Party and entrusting them with responsibilities .,no pledge,INC,2009,trn
402,"Under the UPA rule, the same has not been given its due weightage .",no pledge,BJP,2014,trn
324,Social housing schemes will be launched to meet the needs of the urban poor and to deal with the proliferation of slums .,pledge,INC,2004,trn
815,Geriatric wards with sufficient beds will be opened in every district - level hospital .,pledge,INC,2019,trn
960,A multipurpose agency has been appointed by the government to undertake this task .,no pledge,INC,1999,trn
201,"The Indian National Congress pledges to enact a Right to Food law that guarantees access to sufficient food for all people, particularly the most vulnerable sections of society .",no pledge,INC,2009,trn
837,Necessary measures will be taken to make service in the Armed Forces an attractive career option for the educated Indian youth .,no pledge,BJP,2004,trn
571,Anganwadi and pre - school system will be strengthened to ensure that cases of disabilities are detected at an early stage .,no pledge,BJP,2019,trn
367,It was the first party to set up a committee to review its system of financing to ensure maximum transparency .,no pledge,INC,2004,trn
336,Study the feasibility of a slab - based ‘Compound Tax’ for traders to free them from need - less harassment and end corruption .,no pledge,BJP,2009,trn
160,We have effectively engaged with the international community and obtained a high degree of understanding .,no pledge,BJP,1999,trn
65,"In just five years, non - Congress governments have given seven Prime ministers .",no pledge,INC,1999,trn
755,Greater support will be provided for the promotion of traditional Indian sports and rural transports .,no pledge,BJP,2004,trn
270,Special recruitment drives particularly for Class I and II vacancies will be launched .,pledge,INC,2004,trn
250,We will give even greater impetus to the empowerment of weaker sections of society .,no pledge,INC,2009,trn
482,"They will be offered tax incentives for creating sports infrastructure and sponsoring sports events at district, State, national and international level .",pledge,BJP,2009,trn
536,"Social security and insurance schemes for workers in the unorganised and informal sectors, particularly women will be strengthened and expanded .",no pledge,INC,1999,trn
177,Average Current account deficit as a percentage of GDP during this government has been reduced to 1 . 5% from 3 . 3% during 2009 - 14 .,no pledge,BJP,2019,trn
562,Measures will be taken to remove the hurdles in the faster implementation of all infrastructure projects .,no pledge,INC,1999,trn
174,"c . We will implement a strategy for legal and judicial reform that will enhance quality, responsiveness and timeliness of the judicial system .",no pledge,INC,2014,trn
723,7 . The Indian National Congress will continue and strengthen legal aid for the indigent .,no pledge,INC,2014,trn
404,"A ‘Vishwakarma Initiative’ will be launched for craftspersons and rural artisans to preserve their traditional skills and knowledge, upgrade them, and adapt to new challenges .",pledge,BJP,2004,trn
762,set up a National Optical - Fibre Network up to the village level ; and Wi - Fi zones in public areas .,pledge,BJP,2014,trn
619,The rise of India is the new reality and we shall play a major role in shaping global agenda in the 21st century .,no pledge,BJP,2019,trn
334,"The Congress has been consistent, unlike the BJP, on the issue of dialogue with Pakistan on all issues Including Jammu and Kashmir .",no pledge,INC,2004,trn
749,The people of Jammu and Kashmir are fed up with years of militancy and terrorism .,no pledge,INC,1999,trn
303,"Therefore, a comprehensive policy will soon be formulated to promote affordable broadband connectivity .",pledge,BJP,2004,trn
509,"Added focus will be provided for implementing these programmes in the North - East, Jammu & Kashmir, and areas affected by Maoism .",no pledge,BJP,2009,trn
87,We intend to strongly support attempts to build a system of trade and economic cooperation through expanded global system of trade preferences (GSTP) among developing countries .,no pledge,BJP,1999,trn
212,set up High - speed digital highways to unite the nation .,no pledge,BJP,2014,trn
191,Special infrastructural facilities for substantially expanding international and domestic tourism will be created .,no pledge,INC,2004,trn
92,Involve the state Governments in the promotion of foreign trade and commerce .,no pledge,BJP,2014,trn
791,Officers will be allowed to work in the private sector .,no pledge,BJP,2004,trn
187,"A National Commission for Fisheries and Aquaculture will be set up for promoting all - round development of marine and inland fisheries, and speedy socio - economic progress of fishermen .",pledge,BJP,2004,trn
722,The Bill for 33% reservation for women in Parliament and State Legislatures will be introduced in the very first session of Parliament .,pledge,BJP,2004,trn
157,"As we approach the 150th birth anniversary of Mahatma Gandhi, Bharatiya Janata Party resolves to realize his vision of Gram Swaraj by ensuring that everyone has equitable access to resources .",no pledge,BJP,2019,trn
204,A time - bound programme for restoring all public tubewells to good working condition wherever required will be started .,pledge,INC,2004,trn
992,"People and cattle depend on it for agriculture, fodder and drinking water .",no pledge,BJP,2014,trn
785,We will ensure that tea garden workers are paid wages and given other benefits in accordance with the laws applicable to them and according to the bilateral agreements .,no pledge,INC,2019,trn
846,"promote research and application of nuclear science in medicines, industry and agriculture .",no pledge,BJP,2014,trn
495,An Urban Road Development Fund on the lines of the fund for NHDP will be set up .,pledge,BJP,2004,trn
818,"Ours was the first government to launch national missions for the preservation of manuscripts, monuments, and other facets of India’s cultural, artistic and spiritual heritage .",pledge,BJP,2004,trn
816,The Congress government at the Centre will institute a special scheme for funding the modernisation of the police force in all states .,pledge,INC,1999,trn
11,"In the last five years, we have created a transparent mechanism for directly delivering basic services to the bottom of the pyramid by leveraging Aadhaar, DBT and Jan Dhan accounts .",no pledge,BJP,2019,trn
25,It is the Congress that fought for and won India's freedom .,no pledge,INC,2004,trn
234,"Sixty - seven per cent of our power supply comes from fossil fuels, of which 70 per cent is imported .",no pledge,BJP,2009,trn
36,"Even so, the contest between the Indian National Congress and the BJP is not just a fight between two political parties .",no pledge,INC,2009,trn
941,"Our emphasis was, and remains on, beginning of a new thrust on framing policies that would serve India's national interest in the 21st century .",no pledge,BJP,2014,trn
96,The Indian National Congress is a Party that takes its commitments to the people as sacred .,no pledge,INC,2014,trn
78,"Most of all, it means firm opposition to communalism of all kinds .",no pledge,INC,2004,trn
970,"Our ancestors used to trade with foreign nations through the routes of sea, centuries ago .",no pledge,BJP,2014,trn
177,"Reservation percentages, above 50%, as followed by certain states shall be sanctified through necessary legislative measures .",pledge,BJP,1999,trn
478,"We will strengthen the Indian Council of Cultural Relations, expand its engagement with other countries and encourage the Council to increase the projection of India’s soft power globally .",no pledge,INC,2019,trn
269,Promote SMEs and the retail sector which can generate a large number of jobs and make a meaningful contribution to the national economy .,no pledge,BJP,2009,trn
881,Regulation of Teacher Training Institutes will be the responsibility of the National Council for Teacher Education and their funding will be the responsibility of the University Grants Commission or its successor .,pledge,INC,2019,trn
351,"Congress reiterates its firm belief that the principles underlying these taxes should be simplicity, transparency and progressivity .",no pledge,INC,2019,trn
493,Congress promises to remove the anomalies in the implementation of OROP .,no pledge,INC,2019,trn
817,Measures will be taken to undertake constant training of police personnel at all levels and sensitise them to the concerns of ordinary citizens .,no pledge,INC,1999,trn
256,The Indian National Congress will announce a Jobs Agenda within 100 days of forming the government .,no pledge,INC,2014,trn
525,We will promote art education in schools and colleges and support institutions that exclusively teach the arts .,no pledge,INC,2019,trn
755,We will evolve an economic model of Port - led development .,pledge,BJP,2014,trn
537,"Skill Mapping - to help scientifically plan our national human resource development that India would need (like engineers, architects, doctors, nurses, lawyers, accountants, plumbers, carpenters, welders, etc . ) .",no pledge,BJP,2014,trn
462,"For markets that mainly support agriculture and the rural economy, this will be considered priority sector lending .",pledge,BJP,2004,trn
481,BJP believes that education is the most powerful tool for the advancement of the nation and the most potent weapon to fight poverty .,no pledge,BJP,2014,trn
52,We will also encourage the bureaucracy to take right decisions and contribute their might in building a modern India .,no pledge,BJP,2014,trn
624,All policy and procedural barriers to faster exports must be dismantled .,no pledge,INC,1999,trn
561,The Programme will make every possible effort to change the road safety culture while establishing clear road safety norms .,no pledge,INC,2014,trn
604,re - visit the policy framework for investments both foreign and domestic to make them more conducive .,no pledge,BJP,2014,trn
97,The Party has worked to realise almost all the promises made to the people in its earlier Manifestos and campaigns .,no pledge,INC,2014,trn
138,Civil nuclear agreements have been entered into with many countries entirely on our terms .,no pledge,INC,2009,trn
164,"Mahila Sashaktikaran, to provide for the political empowerment and full educational, economic and legal equality for women ;",no pledge,INC,2004,trn
592,"Additional, dedicated budgetary resources will be provided for faster development of backward areas in each state .",pledge,BJP,2004,trn
37,"Moreover, it reflects the bad intentions of those sitting in power .",no pledge,BJP,2014,trn
555,"LIC and GIC will be strengthened, corporatised and professionalised to equip them to deal with competition .",no pledge,INC,1999,trn
670,"The objectives of the Model Police Act will be to make the police forces modern, technologyenabled, people - friendly, and upholders of human rights and legal rights .",no pledge,INC,2019,trn
52,"The BJP believes that after five years of drift and missed opportunities, the time has come for a Government that works, a Government that cares .",no pledge,BJP,2009,trn
879,Teacher training and the continuing education of teachers are the key to quality instruction .,no pledge,INC,2019,trn
19,The Indian National Congress is fighting these elections in alliance with like - minded parties in some States .,no pledge,INC,2009,trn
548,Facilitating access to minor forest produce and creating a network of rural markets .,no pledge,BJP,2009,trn
500,1998 witnessed the most unprecedented Increase in the prices of essentlal food items due to the totally insensitive policies of the BJP government .,no pledge,INC,1999,trn
787,The strength and vibrancy of a true democracy are often judged by the rights and protection accorded to its minorities .,no pledge,INC,2019,trn
871,"Launch 'National Mission on Himalayas' as a unique programme of inter - governmental partnership, in coordinated policy making and capacity building across states and sectors .",pledge,BJP,2014,trn
532,The time has now come to forge a national consensus on new industrial relations Bill that reflects the contemporary needs of the economy .,no pledge,INC,1999,trn
589,"In districts like Murshidabad in Bengal, young girls are being forced by poverty into making bidis on pathetic wages .",no pledge,BJP,2009,trn
120,Our Pradhan Mantri Krishi SAMPADA Yojana highlights our focus on warehousing as a means of increasing farmers’ income .,no pledge,BJP,2019,trn
204,"Apart from increasing incomes for farmers, this will also generate new employment .",no pledge,INC,1999,trn
179,We have already initiated the process of equipping our police and other specialist security forces with the latest weapons and technology to meet terrorist threats .,no pledge,INC,2009,trn
