text_id,text,label,metadata__party,metadata__year,metadata__split
227,A new national service scheme will be started to involve fresh graduates in key nation - building activities .,pledge,INC,1999,trn
478,7 . The Indian National Congress will ensure 100% modernisation and digitisation of land records to ensure transparency in land titles .,pledge,INC,2014,trn
14,"In the last five years, we re - imposed macro - economic stability while building lasting frameworks for economic governance .",no pledge,BJP,2019,trn
331,6 . All Scheduled Caste and Scheduled Tribe students fulfilling the admission criteria will be provided with universal access to the Rajiv Gandhi Research Fellowships .,pledge,INC,2014,trn
464,"We promise to reverse these damaging developments and repose faith in our diplomatic corps to advise on, formulate and conduct foreign policy .",no pledge,INC,2019,trn
69,"In Jammu & Kashmir, separatists continue to use the services of Pakistani terrorists to promote their agenda of relentless violence .",no pledge,BJP,2009,trn
489,We will enhance the capacity of the Border Roads Organisation and create separate divisions to build roads along the India - China and the India - Myanmar borders .,pledge,INC,2019,trn
191,We believe that Information Technology is an important vehicle for future development .,no pledge,BJP,1999,trn
100,We reiterate our position since the time of the Jan Sangh to the abrogation of Article 370 .,pledge,BJP,2019,trn
851,The present generation has to make this world a better place to live .,no pledge,BJP,2014,trn
798,All elected representative of the Congress will declare their assets on the day of his entering and demitting the office .,pledge,INC,1999,trn
7,We have lost a wonderful opportunity and have pushed the country 20 years behind and rendered millions of men and women jobless .,no pledge,BJP,2014,trn
99,"In the last fifty years, Congress governments have successfully implemented reservations for backward classes in several Congress - ruled states in the southern and the western regions of the country .",no pledge,INC,1999,trn
510,They also have the best record in repaying bank loans .,no pledge,BJP,2004,trn
914,Colleges and universities will be encouraged to build endowment funds to support deserving poor students .,no pledge,INC,2019,trn
427,8 . We will continue to place a special focus on ensuring educational access to civil strife affected areas and the North East region .,no pledge,INC,2014,trn
805,Legislation will be introduced to ensure that important offices of the Indian State can be occupied only by those who are India’s natural citizens by their Indian origin .,pledge,BJP,2004,trn
770,Politics in these two states has to become the catalyst for change .,no pledge,INC,1999,trn
644,Laws must be just and reasonable and reflect our Constitutional values .,no pledge,INC,2019,trn
53,We will examine the possibility of enacting a Fiscal Responsibility Act .,no pledge,BJP,1999,trn
318,The BJP will adopt a National Land Use Policy which will protect the interests of farmers .,no pledge,BJP,2009,trn
103,We will take all steps to ensure a safe and peaceful environment for all residents of the state .,no pledge,BJP,2019,trn
682,All efforts will be made for the eradication of filariasis within five years .,pledge,BJP,2004,trn
99,"Any activity, which disrupts the integrity of the nation, cannot be in the interest of any segment of the society or any region of the country .",no pledge,BJP,2014,trn
253,"In the 10 years of UPA rule, policy paralysis and corruption had derailed infrastructural development .",no pledge,BJP,2019,trn
669,The RTI has been our most powerful weapon in the fight against corruption .,no pledge,INC,2014,trn
182,"Congress promises to enhance infrastructure in rural areas and improve the quality of public goods such as roads, bridges, water supply, sanitation, electricity and schools .",no pledge,INC,2019,trn
607,These areas will be brought into the system in a timebound manner .,no pledge,INC,1999,trn
768,54 of the 100 most backward districts of the country are in UP and Bihar .,no pledge,INC,1999,trn
919,The Congress wants closer bilateral ties with Pakistan but Pakistan has to change Its attitude to India in a most fundamental manner .,no pledge,INC,1999,trn
902,Systems for the timely analysis and assessment of the intelligence gathered have to be put in place .,no pledge,INC,1999,trn
749,This will bring tremendous relief to the families of Ex - Servicemen .,no pledge,INC,2014,trn
441,Special courts dealing with women - related issues will be established all over the country .,pledge,INC,1999,trn
713,"It will aim at ensuring that every woman has some means of livelihood and, additionally, at enhancing the incomes of all categories of working women .",pledge,BJP,2004,trn
578,"Training in skills will begin in secondary schools . When a student matriculates, she/he will have acquired some job - oriented skills .",pledge,BJP,2004,trn
517,The emergence of Indian multinationals and Indian brands will be actively encouraged and supported .,no pledge,INC,1999,trn
163,"Arthik Navotthan to unleash the creative energies of our professionals and entrepreneurs, the cutting edge of our middle class ;",no pledge,INC,2004,trn
199,"Making India a global manufacturing hub - as we position India as a global manufacturing hub over the next five years, we will take the following steps :",no pledge,BJP,2019,trn
457,"The Centre will work closely with State Governments on a time - bound plan of action, to be called ‘Behtar Bazaar Action Plan’, which will include the following initiatives :",pledge,BJP,2004,trn
58,"Intent to do the right thing and the will to do things rightly, is missing .",no pledge,BJP,2014,trn
260,"This includes massive budgetary allocation for railways, highways, village roads and other health as well as educational infrastructure .",no pledge,BJP,2019,trn
496,This will ensure Gross Irrigated Area crosses 10 crore hectares in India .,no pledge,INC,2014,trn
250,"Implementation of works under the Rs . 15,000 - crore National Rail Vikas Yojana, launched in December 2002, will be completed in time .",pledge,BJP,2004,trn
60,The Left Parties and their present partners pride themselves on being secular .,no pledge,INC,2009,trn
139,"BJP is committed to strengthen self - Governance at the local level and we will empower Panchayati Raj Institutions with extensive devolution of the 3 Fs - Functions, Functionaries and Funds .",no pledge,BJP,2014,trn
325,"In 1998, the NDA Government inherited not only an extremely difficult power situation, but also a defective power policy and a flawed sector reform program .",no pledge,BJP,2004,trn
848,The Annual Budgets will indicate the step up in each year in order to achieve the target in 2023 - 24 .,pledge,INC,2019,trn
632,India will continue to proactively encourage investment from foreign companies and overseas Indians .,no pledge,INC,1999,trn
31,"By lowering inflation and cleaning up the banking system, we are now in a position to structurally lower the real cost of capital .",no pledge,BJP,2019,trn
695,"We will promote our traditional systems of medicine, namely Ayurveda, Siddha, Unani, Yoga, and Naturopathy, as also homeopathy .",no pledge,BJP,2004,trn
32,The BJP’s narrow and communal perspective denies equality to all .,no pledge,INC,2014,trn
562,Years of neglect has delayed their integration into the social mainstream .,no pledge,BJP,2009,trn
16,The choice now is between a coalition that has failed miserably and a cohesive Congress alternative .,no pledge,INC,1999,trn
494,"To further promote a research - orientation in our higher education institutions, we will take it forward by providing access to leading journals free of cost to the students .",pledge,BJP,2019,trn
218,It will redouble its efforts to distribute surplus productive land to the landless .,no pledge,INC,2004,trn
100,All Indians living in different regions of the country have an equal stake in the progress of the country and they have to be assured of the fruits of the progress .,no pledge,BJP,2014,trn
236,"The BJP proposes to invest heavily in developing non - fossil fuel - based clean energy sources, especially for electricity production .",no pledge,BJP,2009,trn
523,We propose to take strong measures to promote the manufacturing industry .,no pledge,INC,2014,trn
163,"The BJP will further build upon India - Afghanistan relations and work in close association with the international community to ensure a stable, secure and prosperous Afghanistan .",no pledge,BJP,2009,trn
135,"Hiding behind the façade of the NDA, the BJP is misleading the people of our country .",no pledge,INC,2004,trn
690,The Indian National Congress will continue the process of police modernisation .,no pledge,INC,2014,trn
391,Close linkages between school education and higher education shall be built into the system .,no pledge,BJP,2009,trn
236,"While the above presents a medium - term agenda for reform, the immediate priority is to ensure that the economy gets back on track to the target of 8 % growth .",no pledge,INC,2014,trn
235,"Dairying, aquaculture, fisheries, horticulture and sericulture will receive an additional boost .",no pledge,INC,2009,trn
59,This will realize our strategic vision of making India a Developed Nation .,no pledge,BJP,2004,trn
222,New financing structures will be created for long term funds and pooling of investments .,no pledge,INC,2014,trn
406,Special coaching facilities for SC/ST/OBC students at all levels will be expanded .,pledge,INC,1999,trn
48,"At a time when stability was of the essence, we have got instability .",no pledge,INC,1999,trn
196,More than 90% FDI approvals are now through the automatic route .,no pledge,BJP,2019,trn
726,"Hence, Congress promises to set up an Equal Opportunities Commission, which will recommend affirmative action strategies and policies to achieve equality—and equity—in education, employment and in economic opportunities .",pledge,INC,2019,trn
831,"Its cooperation will be sought in strengthening civic discipline, adherence to law, tax compliance, and care for public property .",no pledge,BJP,2004,trn
689,"Value addition will be encouraged through avenues like - branding, packaging and technology .",no pledge,BJP,2014,trn
244,The UPA Government’s mismanagement of the national economy and fiscal indiscipline has resulted in frittering away the tremendous gains of the NDA years .,no pledge,BJP,2009,trn
396,Interest rates must be such so as to stimulate not just investments but also provide adequate returns to savers .,no pledge,INC,2004,trn
217,"Moreover, domestic tourism has a crucial role to play in promoting national integration .",no pledge,INC,1999,trn
514,Special incentives will be provided for women’s SHGs to be formed in every neighborhood .,pledge,BJP,2004,trn
539,The decisions taken by our Government have greatly helped India’s film and TV industry in recent years .,no pledge,BJP,2004,trn
892,Ex - Servicemen and their co - operatives will be used for specific development programmes like literacy and afforestation .,no pledge,INC,1999,trn
609,One of our main targets will be to eradicate the curse of malnutrition .,pledge,BJP,2009,trn
662,Importance given to programmes to arrest the melting of Himalayan glaciers from which most major rivers in North India originate .,no pledge,BJP,2009,trn
305,The Indian National Congress will also upgrade the technical capabilities of panchayat institutions and ensure that information technology is used extensively to enhance their effectiveness .,no pledge,INC,2009,trn
97,There is need for affirmative action in the form of reservation also .,no pledge,INC,1999,trn
90,We will make all efforts to clarify the issues to the sections of population from the Northeastern states who have expressed apprehensions regarding the legislation .,no pledge,BJP,2019,trn
69,The Congress embodies the idea of lndia like no other party does .,no pledge,INC,2004,trn
555,Environment impact assessment of for development projects and industrial clusters will be strengthened .,no pledge,BJP,2004,trn
76,"Taking these aspirations into consideration, the centre and the states therefore have to evolve a working system, which leads to harmonious relations .",no pledge,BJP,2014,trn
480,"While we have world - class Technology, Science and Medical institutions, the same needs to be replicated in other areas .",no pledge,BJP,2019,trn
526,Issues relating to corporate governance involving a concern for all major stakeholder interests will be dealt with on a priority basis .,no pledge,INC,1999,trn
814,"Under the Right to Healthcare Act, we will provide affordable and quality healthcare to senior citizens in hospitals including free diagnostics, out - patient treatment, medicines and hospital treatment .",pledge,INC,2019,trn
86,"Yet, it recognises minorities of several kinds because of the some disadvantages and handicaps they suffer and the special help they may need .",no pledge,INC,1999,trn
748,This will result in the faster movement of people and goods .,no pledge,BJP,2014,trn
618,"There shall be a single destination to electronically pay all taxes and regulatory charges—whether Central, State, or local—for all classes of business .",pledge,BJP,2004,trn
945,This will be restored and a special effort made to expand India's relationship with South Africa and other countries in the region .,no pledge,INC,1999,trn
181,We will continue with our policy in the similar manner – lowering of tax rate thereby rewarding honest tax payers and improving compliance .,no pledge,BJP,2019,trn
888,State Governments will be taken into confidence for harnessing of these resources .,no pledge,BJP,2014,trn
107,"Northeast : Resource rich North - Eastern states are lagging behind in development due to poor governance, systemic corruption and poor delivery of public services .",no pledge,BJP,2014,trn
260,Operation Cleanliness will be completed by 2007 to give a new image to Indian Railways .,no pledge,BJP,2004,trn
80,This and the Agriculture sectors are an untapped source with unlimited scope for generation of employment .,no pledge,BJP,1999,trn
154,"These will sort, grade, process, store, and pack agricultural and horticultural produce for shipment to markets and further value - addition .",pledge,BJP,2004,trn
19,"This is the moment to look ahead, to a new, resurgent India .",no pledge,BJP,1999,trn
238,"This requires that we look at transport connection, heritage conservation, hotels, restaurants, entertainment and other services in an integrated way .",no pledge,BJP,2019,trn
482,a . Probity and transparency is ensured in the functioning of Panchayats and their elected representatives ;,no pledge,INC,2014,trn
828,"Leveraging of technologies such as information technology, biotechnology and material sciences would be done with special importance .",no pledge,BJP,2014,trn
338,The Indian National Congress now pledges to take the next decisive step and introduce a moderate goods and services tax (GST) .,no pledge,INC,2009,trn
355,An epidemiological surveillance system will be set up all over the country to facilitate early detection and prompt response for the rapid containment and control of the outbreak of disease .,pledge,INC,1999,trn
440,Congress promises to rapidly expand domestic capacity to manufacture defence and security equipment .,no pledge,INC,2019,trn
596,"Recognising the challenges of urbanisation ahead, the Indian National Congress is committed to adopting a proactive approach to address them .",no pledge,INC,2014,trn
468,Set up an All Women Mobile Bank to cater to women .,pledge,BJP,2014,trn
243,These are the weak link in our road network that includes world - class national highways on one end and rapidly improving rural roads on the other end .,pledge,BJP,2004,trn
436,"Indigenous knowledge, based on our long and rich tradition will be further developed and harnessed for the purpose of wealth and employment generation .",no pledge,BJP,2009,trn
76,"For the Congress, secularism means full freedom and respect for all religions .",no pledge,INC,2004,trn
228,"Facilitating establishment of 50,000 new Startups in the nation by 2024 .",pledge,BJP,2019,trn
248,The Congress recognises the increasingly acute problem of fragmentation of existing land holdings and the need to consolidate them with a view to ensuring economic viability .,no pledge,INC,1999,trn
730,"74 Complete the development of all projects under Swadesh Darshan, PRASAD and HRIDAY schemes .",no pledge,BJP,2019,trn
136,"We will enable the creation of 10,000 new Farmer Producer Organisations (FPOs) by 2022 to ensure economies of scale for farmers regarding access to inputs and markets .",pledge,BJP,2019,trn
820,"These will be effectively implemented, with extensive participation of communities, business houses, professional bodies, and NGOs .",pledge,BJP,2004,trn
77,"What India needs is an intelligent and wise foreign policy, a foreign policy that is rooted in our traditions, gives us strength through our unity and common purpose, and radiates confidence .",no pledge,INC,2009,trn
840,"Our government shall further strengthen and stabilize this trend, and work towards realizing our vision of a riot - free India .",pledge,BJP,2004,trn
508,"Technical and management services for those engaged in handicrafts, food - processing, handloom, garments, etc, will be strengthened .",no pledge,BJP,2009,trn
361,"In the last five years, we have put in place a framework of governance which will yield rich dividends over the next generation .",no pledge,BJP,2019,trn
27,"This was not, as claimed, a government with a difference .",no pledge,INC,1999,trn
16,The defence of India and the needs of our armed forces is our commitment .,no pledge,BJP,1999,trn
860,Ensuring that the ethnic identities of all the people in the North - East are protected .,no pledge,BJP,2004,trn
678,"All support, including financial, will be provided to the State Government for this purpose .",no pledge,BJP,2009,trn
202,Make all institutions and schools e - enabled in a phased manner .,no pledge,BJP,2014,trn
122,"The scams wiped out the hard - earned savings of crores of middle class families, senior citizens, pensioners and widows .",no pledge,INC,2004,trn
525,Visa on arrival ; common tourist visa for SAARC countries ; simplify visa requirements ; reduce visa fees and grant visas within 24 hours .,pledge,BJP,2004,trn
381,"Build quality integrated Public Transport systems, discouraging usage of private vehicles .",no pledge,BJP,2014,trn
652,We should no longer remain a market for the global industry .,no pledge,BJP,2014,trn
351,A structured and transparent approach to alleviate the burden of debt on states so as to enable them to Increase social sector Investments will be adopted .,no pledge,INC,2004,trn
1000,"Heritage Sites : We will provide appropriate resources for the maintenance and restoration of all national heritage sites, and to prevent their vandalisation in any form .",no pledge,BJP,2014,trn
201,We will further work in this direction to take the country’s ranking into the top 50 .,pledge,BJP,2019,trn
223,This will be available against ‘Food Coupons’ redeemable at both PDS and private outlets .,no pledge,BJP,2009,trn
172,"Government systems and processes would be relooked to make them citizen friendly, corruption free and accountable .",no pledge,BJP,2014,trn
71,We will also ensure that the chain of responsibility and accountability is built in the system .,no pledge,BJP,2014,trn
666,"Computerisation of key government departments especially those that deal with the public on an on - going basis, will be carried out in a massive manner .",no pledge,INC,1999,trn
265,The Congress will create a national consensus on the issue of dalits and adivasis getting a reasonable share of jobs in the private sector .,no pledge,INC,2004,trn
367,India too has begun to feel its impact in different ways .,no pledge,INC,2009,trn
98,"The May 2004 mandate was for a government that would accelerate economic growth but with a focus always on livelihoods and jobs, on inclusive growth and on social justice .",no pledge,INC,2009,trn
30,"In the last five years, we have created a national common market for the industry and services sectors .",no pledge,BJP,2019,trn
532,We also have to develop India as a Knowledge Powerhouse .,no pledge,BJP,2014,trn
119,"Moreover, the new highways being built are not free ; they can be used only after payment .",no pledge,INC,2004,trn
484,"This would be possible only when Education accords due emphasis on national integration, social cohesion, religious amity, national identity and patriotism .",no pledge,BJP,2014,trn
220,good performance will be rewarded ; non - performers will be given opportunities and training support to improve .,no pledge,BJP,2014,trn
43,Our Government launched some of the biggest - ever social development initiatives in the world .,no pledge,BJP,2004,trn
470,"Encouraged by the success of our program to facilitate construction of twenty lakh additional houses each year, we propose to raise the target to thirty lakh each year .",pledge,BJP,2004,trn
129,"On this count alone, the people of India must reject the BJP .",no pledge,INC,2004,trn
133,This will bring government closer to the people and make it more responsive and accountable .,no pledge,INC,1999,trn
85,"We will also expedite comprehensive reform of the PSUs, including restructuring, rehabilitation and divestment .",no pledge,BJP,1999,trn
624,"To achieve this, greater competition will be created by extending the reach of PSU banks and expanding the activities of private banks .",no pledge,BJP,2004,trn
29,"It was the Congress that made our Constitution possible, a national charter for radical but peaceful socio - economic transformation .",no pledge,INC,2004,trn
689,2 . The Indian National Congress will continue its efforts to enact the Women’s Reservation Bill to ensure one - third reservation for women in Parliament and State legislatures .,no pledge,INC,2014,trn
914,"Co - operation in other areas like power, natural gas, tourism and education will be actively fostered .",no pledge,INC,1999,trn
978,"However, where required we will not hesitate from taking strong stand and steps .",no pledge,BJP,2014,trn
91,Adequate supply of quality power will be ensured to all farmers by 2009 .,no pledge,BJP,2004,trn
718,"Enterprises promoted by women, or employing a large number of women, will be given ‘fast track’ facilitation .",no pledge,BJP,2004,trn
285,About 6 - 8% of our population comprising the most destitute and Infirm do not have access to the PDS even where the PDS works well .,pledge,INC,2004,trn
291,Exports and imports shall be free and consistent with WTO rules .,no pledge,INC,2019,trn
84,"Mandatory community participation in planning, execution, and maintenance of irrigation projects through mechanisms such as Water Users’ Associations .",pledge,BJP,2004,trn
105,Penalties have increased and new crimes were included to make the definition more women friendly so that the law better serves the interests of the aggrieved .,no pledge,INC,2014,trn
332,"In addition, 1000 overseas scholarships for eligible students will be provided annually .",pledge,INC,2014,trn
595,Those who espouse terrorism have stepped outside the moral code of their religion into barbarism .,no pledge,BJP,2009,trn
294,The Gram Sabha will be empowered to emerge as the foundation of the pnnchayati raj system .,no pledge,INC,2004,trn
1028,Pass regulations to stop the spread of fake news and hate speech and punish those who misuse digital and social media .,pledge,INC,2019,trn
809,We will examine the feasibility of providing compartmental reservation for Denotified and Semi - Nomadic Tribes as citizens belonging to socially and educationally Backward Classes .,no pledge,INC,2019,trn
171,"Tragically, the services have been ignored by the Congress and failure to address the concerns of the Army, Air Force and Navy has bred undesirable discontent .",no pledge,BJP,2009,trn
439,"Recent efforts to preserve, catalogue, and develop India’s indigenous traditions in science and technology will be further encouraged .",no pledge,BJP,2004,trn
469,These institutions would provide four - year integrated courses that would set the standards for quality teachers in our schools .,pledge,BJP,2019,trn
19,Troubled parts of the North - East are seeing fruits of the NDA Government’s consistent pursuit of peace and conflict - resolution through dialogue .,no pledge,BJP,2004,trn
120,We will also offer lower rates of corporate and personal income tax on tourism - related business income .,pledge,INC,2019,trn
711,Remove ambiguity in rules to make way for prompt decisions without any scope for discretion .,no pledge,BJP,2014,trn
539,Laws that have been made in respect of labour in the unorganised - sector will be implemented vigorously and where necessary new laws will be formulated .,no pledge,INC,1999,trn
1052,It is now time for you to make a choice .,no pledge,INC,2019,trn
699,44 Target provisioning of telemedicine and diagnostic laboratory facilities at all health and wellness centres to ensure quality primary medical care to the poor at their doorstep .,no pledge,BJP,2019,trn
355,Setting up of services specific arbitration courts to settle consumer disputes .,no pledge,BJP,2009,trn
158,"In the past 13 months the government demonstrated its capability to secure for India a place, role and position in the global arena, commensurate with its size and importance .",no pledge,BJP,1999,trn
340,"It will reaffirm our traditional bonds with countries like Russia, Japan and the European Union .",no pledge,INC,2004,trn
736,Millions want to visit it and it can be developed as a centre of cultural tourism .,no pledge,BJP,2009,trn
