text_id,text,label,metadata__party,metadata__year,metadata__split
409,The Indian National Congress also believes that the two countries must take note of India’s security concerns in a more meaningful manner .,no pledge,INC,2009,trn
737,"The Brahmaputra Board will be activated and studies, demonstration projects and actual schemes will be taken up .",pledge,INC,1999,trn
376,Indian industry will be encouraged in every manner to enhance its global presence .,no pledge,INC,2004,trn
333,"The Indian National Congress remains committed to ensuring the highest standards of corporate governance in private companies, especially to protect the interests of small shareholders and small investors .",no pledge,INC,2009,trn
36,It said it would give us a review of our security environment .,no pledge,INC,1999,trn
767,"8 . On Sri Lanka, we will engage with that country to ensure that the Tamil - speaking people and other minorities have full equality and equal rights under the law .",no pledge,INC,2014,trn
527,"Congress will support government and private efforts to establish museums, art galleries, libraries and archives .",no pledge,INC,2019,trn
579,"This will include, but not be limited to capital assistance in new educational projects, both for basic and technical education, in low - income minority areas .",no pledge,BJP,2009,trn
558,"Income tax benefits for senior citizens will be made available at 60 years, instead of 65 years as is the practice at present .",pledge,BJP,2009,trn
146,The security forces have also successfully foiled the plans of Naxalites to expand their nefarious activities .,no pledge,INC,2009,trn
789,Senior officers will be suitably empowered to take timely and bold decisions .,no pledge,BJP,2004,trn
469,The NDA Government remains committed to the goal of ‘Housing for All by 2010’ .,no pledge,BJP,2004,trn
363,"Through the idea of Rurban, we will bring urban amenities to our rural areas, while retaining the soul of the village .",no pledge,BJP,2014,trn
462,Fund for relief and rehabilitation of rape victims lies unused at the Centre as the Government has not worked out the modalities of dispensation .,pledge,BJP,2014,trn
740,India’s security preparedness will be based on a comprehensive security doctrine that combines conventional and strategic measures .,no pledge,INC,2014,trn
391,"Household and artisanal manufacturing industry that is the lifeline of many towns and cities across the country will be modernized and given greater technological, investment and marketing support .",no pledge,INC,2004,trn
176,We are committed to extending the SC/ST reservations for another 10 years .,pledge,BJP,1999,trn
699,They will be suitably assisted to play a bigger and more effective role in improving the health profile of the rural poor .,no pledge,BJP,2004,trn
249,A national scheme of health insurance for families living below the poverty line will be proposed .,pledge,INC,2004,trn
710,Review obsolete and multiple laws to reduce and simplify them .,no pledge,BJP,2014,trn
286,"Since devolution requires the decentralisation of functions, functionaries and finances, it will be ensured that budgets, staff, other resources and corresponding authority are Integrated into the devolution package ;",pledge,INC,1999,trn
573,The pace of construction of hydel projects particularly will be speeded up .,no pledge,INC,1999,trn
327,The abolition of poverty remains the foremost goal of the Congress .,no pledge,INC,2019,trn
126,"All financial transactions, purchase of property and access to public services will be possible only on the basis of the National Identity Card which will be made forgery and hacking resistant .",no pledge,BJP,2009,trn
65,It was Rajiv Gandhi who declared Swami Vivekananda's birth anniversary on January 12th as National Youth Day .,no pledge,INC,2004,trn
179,"With improved compliance and increased tax base, the tax to GDP ratio has reached 12%, highest in the recent past, up from 10 . 1% in 2013 - 14 .",no pledge,BJP,2019,trn
256,Organisations that supply inputs to farmers will be converted into farmer managed and controlled organisations .,no pledge,INC,1999,trn
495,"Public spending on education would be raised to 6% of the GDP, and involving the private sector would further enhance this .",pledge,BJP,2014,trn
85,We recognize the special needs and unique problems of the hill and desert states .,no pledge,BJP,2014,trn
49,It is the Congress that launched liberalization and economic reforms .,no pledge,INC,2004,trn
1,We have demonstrated what all can be achieved by a committed and decisive leadership that is not afraid to take hard decisions .,no pledge,BJP,2019,trn
438,"The Constitution will be amended to provide for one - third reservations for women ln the Lok Sabha, Rajya Sabha, Vidhan Sabhas and Vidhan Parishads .",pledge,INC,1999,trn
737,"The Integrated Child Development Scheme (ICDS), the world’s largest early childcare programme, will be further strengthened .",no pledge,BJP,2004,trn
720,6 . The Indian National Congress government will support all measures taken by the judiciary to improve court management so as to ensure quick and timely disposal of cases .,no pledge,INC,2014,trn
22,The physical infrastructure of the country has undergone an unprecedented upgrade in the last five years .,no pledge,BJP,2019,trn
12,"In that period, the Congress gave to the country five Prime Ministers .",no pledge,INC,1999,trn
440,Our science and technology policy will be framed and implemented so as to be in harmony with our worldview of the larger human family .,no pledge,BJP,2009,trn
297,A number of programmes have already been launched to combat the still widely - prevalent phenomenon of child malnutrition and these will be infused with an even greater sense of urgency .,no pledge,INC,2009,trn
588,"We need to work effectively to increase household access to LPG and kerosene, especially the availability to rural households .",no pledge,INC,2014,trn
231,"All possible meaures will be taken to setup the momentum of public investment in agriculture, especially in the backward and poorer regions .",pledge,INC,1999,trn
207,An intensive agricultural development programme for the 100 - odd districts In the arid and semi - arid regions of the country will be put In place .,pledge,INC,2004,trn
474,Congress promises to pass a Law on Asylum consistent with international treaties and conventions .,pledge,INC,2019,trn
816,"The institution of the Gram Sabha will be strengthened to discuss every developmental work, scrutinize the allocation and spending of funds, and evaluate the performance of panchayat and government functionaries .",no pledge,BJP,2004,trn
682,Article 370 poses a psychological barrier for the full integration of the people of Jammu & Kashmir with the national mainstream .,no pledge,BJP,2009,trn
178,We will establish an appropriate legal framework for the protection of the environment and unveil a National Environment Policy to balance between development and ecology .,no pledge,BJP,1999,trn
284,We will combat communalism of all kinds and caste atrocities with determination .,no pledge,INC,2009,trn
17,"Jammu & Kashmir basks again in the sunshine of regained peace, well set now on the road to development .",no pledge,BJP,2004,trn
106,Regional aspirations : BJP has always stood for greater decentralization through smaller States .,no pledge,BJP,2014,trn
757,"We will modernize existing ports on one hand, and develop new ones on the other - stringing together our Sagar Mala project .",pledge,BJP,2014,trn
557,Social obligations will be on an even footing for both public and private companies in the insurance industry .,no pledge,INC,1999,trn
890,"The existing machinery to resettle, rehabilitate and to look after the welfare of the ex - servicemen and their families will be strengthened .",no pledge,INC,1999,trn
777,Courts all over the country will be computerized and networked for improving their efficiency .,pledge,BJP,2004,trn
319,"The Governments of Gujarat, Madhya Pradesh and Chhattisgarh have successfully implemented the tribal welfare and development schemes and their model would be used for tribal welfare and development .",no pledge,BJP,2014,trn
440,"Vote for Security, Stability, Continuity and Integrity : Vote Indian National Congress",no pledge,INC,2009,trn
716,Both these programmes will be run with the active involvement of the elected panchayats .,no pledge,INC,1999,trn
438,The BJP government left the National Security Advisory Board in limbo between January 2015 and October 2016 and then truncated the body .,pledge,INC,2019,trn
325,Technologies to promote low - cost housing will be deployed on a large scale .,no pledge,INC,2004,trn
745,"Growth of this sector means the growth of cement, steel, electricity and many other associated industries and directly leads to massive job creation .",no pledge,BJP,2014,trn
258,special steps will be taken to spread modem and technical education among women in minority communities particularly .,no pledge,INC,2004,trn
118,An age - old blot on our society will finally be erased .,no pledge,INC,2014,trn
130,The BJP has fostered corruption to an unprecedented degree with scams after scams being revealed .,no pledge,INC,2004,trn
487,A new and simplified Direct Taxes Act will be made public for discussion before its introduction .,pledge,INC,1999,trn
394,Provisions for certification of skills acquired traditionally or through private initiatives shall be made .,no pledge,BJP,2009,trn
705,There has been significant investment in improving the infrastructure and the working conditions of judges .,no pledge,INC,2014,trn
110,We shall strive to improve the quality of education at all levels — from primary schools to our universities .,no pledge,BJP,1999,trn
445,Congress had also proposed to establish the National Counter - Terrorism Centre and NATGRID .,no pledge,INC,2019,trn
520,The Indian National Congress commits to 10% growth in manufacturing and an increase in contribution of manufacturing sector’s share to 25% of GDP .,no pledge,INC,2014,trn
674,The Indian National Congress will give the highest priority to the passage of the following Bills :,no pledge,INC,2014,trn
940,BJP believes that the strategic gains acquired by India during the Atal Bihari Vajpayee regime on the nuclear programme have been frittered away by the Congress .,no pledge,BJP,2014,trn
197,A special programme for accelerating agticultural growth in these regions will be launched .,no pledge,INC,1999,trn
661,We will scrap the opaque Electoral Bond Scheme that was designed to favour the ruling party .,pledge,INC,2019,trn
114,We will reward businesses that create new jobs by lowering the effective direct tax rates and by lowering contributions to the CSR fund .,pledge,INC,2019,trn
513,We have determinedly taken substantive measures to ensure overall development of women and promote gender equality .,no pledge,BJP,2019,trn
842,We will ensure that government expenditure on healthcare and education will be doubled to 3 per cent of GDP and 6 per cent of GDP respectively by 2023–24 .,pledge,INC,2019,trn
407,"Congress promises to allocate sufficient funds to promote science, technology and innovation .",no pledge,INC,2019,trn
607,We will explore the possibility of direct central grants to Panchayats and Municipalities that was tried successfully in 1988 - 89 under the Government of Shri Rajiv Gandhi .,no pledge,INC,2019,trn
265,The fund will be raised from railway users and augmented by public - private partnerships .,pledge,BJP,2004,trn
307,"Implementation of a national E - Governance strategy will begin before August 15, 2004 .",no pledge,BJP,2004,trn
66,"In recent years, the Union Government has lost every semblance of credibility .",no pledge,BJP,2014,trn
189,We recognize that investment driven growth requires cheaper cost of capital .,no pledge,BJP,2019,trn
135,States of the Union where the percentage of population below the poverty line has increased during the last five decades shall receive special attention .,no pledge,BJP,1999,trn
1051,"With us, you will be sure of a bright future filled with hope for you and your children .",no pledge,INC,2019,trn
409,"After achieving unprecedented success through Mission Shakti, we are committed to ensuring that 'Gaganyaan' successfully demonstrates our scientific capabilities of executing a manned mission in space .",pledge,BJP,2019,trn
56,"At every step, they violated the discipline, restraint and sobriety so very essential for running a coalition smoothly .",no pledge,INC,2009,trn
790,We will launch multi - pronged 'water strategy' for reducing farmer's dependence on monsoon .,pledge,BJP,2014,trn
5,This is the India for which our Freedom Fighters gave their all .,no pledge,INC,2014,trn
725,69 Expand the Pradhan Mantri Shram Yogi Maandhan scheme to cover all small shopkeepers .,no pledge,BJP,2019,trn
862,The activities of the National Human Rights Commission will be given full support and encouragement .,no pledge,INC,1999,trn
25,It is the Congress that fought for and won India's freedom .,no pledge,INC,2004,trn
395,"Banks will be encouraged in every way to expand lending, particularly to agriculture, agro - industry, value - added agriculture, small - scale Industry and infrastructure .",no pledge,INC,2004,trn
695,"At the same time, the bottlenecks in transporting and exporting them have to be removed .",no pledge,BJP,2014,trn
917,"At the same time, durable and enduring confidence - building measures going beyond mere bus rides will be high on the agenda .",no pledge,INC,1999,trn
205,The pace of construction of new irrigation wells in the poorer districts of the country will be accelerared .,no pledge,INC,2004,trn
642,11 . We will continue to strongly advance and protect India’s interests in inter - national climate and other environmental negotiations .,no pledge,INC,2014,trn
46,We intend to invest in our human potential by focusing on the quality of our primary/secondary schools as well as expanding our tertiary education capacity .,no pledge,BJP,2019,trn
969,"Panchayats, Municipalities and NGOs will be supported to install sanitary napkin vending machines in schools, colleges and select public places .",no pledge,INC,2019,trn
355,All government agencies but particularly those that deal with citizens on a day - to - day basis must operate in a responsive and accountable manner .,no pledge,INC,2004,trn
260,The National Minorities Development Corporation and State Minorities Development Corporations will be made direct - lending institutions .,pledge,INC,2004,trn
231,"Congress promises to double the funding in 5 years for teaching, R&D, agriculture - related pure sciences and applied science and technology in the agricultural sector .",pledge,INC,2019,trn
620,Preventive health care by way of inoculation against diseases and dissemination of information will receive focussed attention .,no pledge,BJP,2009,trn
203,Immediate steps will be taken to ease the burden of debt and high interest rates on farm loans .,pledge,INC,2004,trn
86,We will focus on specific products in specific growth areas for exports and announce specific packages for horticulture and forticulture EoUs .,no pledge,BJP,1999,trn
50,It is the Congress's policies that made India the world's fourth largest economy by 1998 .,no pledge,INC,2004,trn
727,"Also, their skills will be upgraded through appropriate training programs .",no pledge,BJP,2014,trn
618,She is emerging as a power and connecting stakeholders in a multi - polar world .,no pledge,BJP,2019,trn
500,"Adequate number of community toilets, run on the pay - and - use principle, will be constructed within three years in every city .",no pledge,BJP,2004,trn
32,The Indian National Congress has always been in the forefront of the battle against those forces that seek to divide and fragment our society .,no pledge,INC,2009,trn
734,It is our aim to achieve enormous progress in the years to come .,no pledge,BJP,2019,trn
688,The Congress will strengthen bodies like the National Development Council and the Inter - State Council and make their functioning business - like and purposive .,no pledge,INC,1999,trn
553,We will establish a single point of contact and simplify the procedures to enable NRIs to invest in businesses in India .,pledge,INC,2019,trn
15,An atmosphere has been created for resolving all outstanding issues through dialogue .,no pledge,BJP,2004,trn
121,We recognise the need to create lakhs of lowskilled jobs in order to absorb young men and women who have completed only a few years in school .,no pledge,INC,2019,trn
135,Growth by itself is not sufficient for addressing the complex challenges that the country faces .,no pledge,INC,1999,trn
507,Self - Help Groups in India are already a big success story .,no pledge,BJP,2004,trn
182,"government will be redefined by elimination of whatever is obsolete in laws, regulations, administrative structures, practices and would be purposive .",no pledge,BJP,2014,trn
293,"We have made all efforts to make the experience of rail journey safe, smooth, clean and satisfying and have achieved great results .",no pledge,BJP,2019,trn
752,The Congress is open to dialogue and discussion with any group within the framework of the Constitution .,no pledge,INC,1999,trn
130,It will be our endeavour to assure them that they continue to remain esteemed and valuable members of society .,no pledge,BJP,1999,trn
190,This will be a high priority area for BJP that IT touches the lives of ordinary men and women .,no pledge,BJP,2014,trn
234,States will be given incentives to speed up restructuring of their road transport corporations .,pledge,BJP,2004,trn
663,We recognize the need for grassroots innovation and will ensure this initiative is well funded .,no pledge,INC,2014,trn
105,Their trial shall be fair and justice will be done to the victims swiftly .,no pledge,BJP,2009,trn
309,The Angel Tax imposed on Start - Ups will be withdrawn completely .,pledge,INC,2019,trn
374,Every tax payer will be subject to assessment by a single authority based upon turnover .,pledge,INC,2019,trn
465,Domestic IT hardware industry to be aggressively promoted to minimise dependence on imports .,no pledge,BJP,2009,trn
329,We will not hesitate to roll back any concessions and facilities not reciprocated by the counterparts .,no pledge,BJP,2009,trn
788,BJP remains committed to giving high priority to water security .,no pledge,BJP,2014,trn
671,17 Work towards increasing the number of seats in premier law institutes .,no pledge,BJP,2019,trn
1001,Congress promises to preserve wildlife habitats and manage and minimise human—wildlife conflict and award compensation for the loss of human lives .,no pledge,INC,2019,trn
207,"Immediately after forming the governments in Chhattisgarh, Madhya Pradesh and Rajasthan, as promised, the 3 Congress Governments waived the loans of farmers .",pledge,INC,2019,trn
649,Revisit laws for protecting forests and reserve parks to make them more effective in preventing encroachment and man - animal conflict .,no pledge,BJP,2009,trn
266,The eradication of poverty is the single most important objective of national development .,pledge,INC,1999,trn
345,"India's northeast demands and will receive special treatment with particular emphasis on roads, power, tourism, communication and handicrafts .",no pledge,INC,2004,trn
207,An intensive agricultural development programme for the 100 - odd districts In the arid and semi - arid regions of the country will be put In place .,pledge,INC,2004,trn
152,"Today, the challenge is to accelerate growth in all sectors of the economy, growth that will generate employment, remove poverty and create prosperity .",no pledge,INC,1999,trn
343,The programme will move from one stage to the other only after a ‘go ahead’ from the panel .,no pledge,INC,2019,trn
413,India has begun a whole new process of engagement with the countries of Africa where there is great appreciation of what India has to offer to them .,no pledge,INC,2009,trn
11,"A time to reinvent the politics as an instrument of social change based on conscience, competence, compassion and commitment .",no pledge,INC,2004,trn
935,These will be consolidated and steps taken to deepen the relationships .,no pledge,INC,1999,trn
836,"Immediate measures will be taken to drastically cut delays in courts, particularly in the High Courts and in lower levels of the judiciary .",no pledge,INC,1999,trn
432,Promotion of innovation by creating a comprehensive national system of innovation .,no pledge,BJP,2009,trn
180,To discourage poaching of Wild Life a Wild Life Anti - Poaching Authority shall be established .,pledge,BJP,1999,trn
198,"Similarly, implementation of One Nation, One Tax through GST has brought all businesses under single tax net .",no pledge,BJP,2019,trn
242,"The Indian National Congress is firmly committed to ensuring that farmers get, at a very minimum, market rates for the land that is acquired for industrial projects .",no pledge,INC,2009,trn
232,"Pradhan Mantri Gram Sadak Yojana : Linking all rural habitations with a population above 1,000 by 2005 ; linking all rural habitations with a population above 500 by 2007 .",pledge,BJP,2004,trn
526,BJP will set up a National Commission on Education to report in two years on the state of and the reforms needed .,pledge,BJP,2014,trn
753,The Indian National Congress is committed to the articulation and implementation of a robust and dynamic foreign policy .,no pledge,INC,2014,trn
560,Road Accidents will be halved within five years by strong willed political commitment to this Programme .,pledge,INC,2014,trn
707,Satellite towns will be developed with full infrastructure to ease the pressure on existing metros and big cities .,no pledge,INC,1999,trn
122,It has also introduced a cooked mid - day meal scheme in all primary schools that feeds 15 crore children every day .,no pledge,INC,2009,trn
173,Faster and broad - based economic growth is an essential pre - requisite for accelerating employment generation .,no pledge,INC,2004,trn
171,The objective will be to bring in transparency in Government's decision making process .,no pledge,BJP,2014,trn
404,"All reservation quotas, including those relating to promotions, will be sought to be filled on a time - bound basis .",pledge,INC,1999,trn
181,We will continue to protect and advance the interests of our defence personnel and ex - servicemen .,no pledge,INC,2014,trn
447,"Attractive career path needs to be planned for sportspersons providing security of career through jobs in government, PSUs and private sector .",no pledge,BJP,2014,trn
750,The NDA Government aims to make India a major sports power in the world .,no pledge,BJP,2004,trn
388,The Congress will ensure that disinvestment increases competition and consumer welfare .,no pledge,INC,2004,trn
621,A national programme will be launched to vaccinate adults and children against all forms of hepatitis .,pledge,BJP,2009,trn
540,"Both have a huge potential for further growth, including in the area of employment generation .",no pledge,BJP,2004,trn
561,Education and Training - Will review the role of various professional regulatory bodies in healthcare and consider setting up an overarching lean body for healthcare .,pledge,BJP,2014,trn
359,Enhanced oil production through increased exploitation of own resources as well as purchase of ownership in oil fields overseas .,pledge,BJP,2004,trn
463,"Traditional trading communities in Indian society, who have a wealth of knowledge and experience in this field, will be suitably encouraged .",pledge,BJP,2004,trn
341,"g . As the nominal GDP grows and families move out of poverty, the cost will decline as a proportion of GDP .",pledge,INC,2019,trn
320,"b . We must get government into addressing notable market failures through regulation (e . g . capital market, banking, etc . ) ; and",no pledge,INC,2019,trn
216,The Congress will ensure the fullest implementation of minimum wage laws for farm labour .,pledge,INC,2004,trn
450,A nation - wide assessment of the prevalence of this problem will be undertaken .,no pledge,INC,2014,trn
34,"At the national level, the BJP has sought to position itself as the main political rival of the Indian National Congress .",no pledge,INC,2009,trn
830,"The number of committees dealing with specialised subjects will be increased and their functioning made more consultative, time - bound and professional .",pledge,INC,1999,trn
241,"Academic excellence and professional competence would be the sole criteria for all appointments to bodies like the ICHR, ICSSR, UGC, NCERT, etc .",no pledge,INC,2004,trn
115,"The Indian National Congress piloted and passed the Street Vendors (Protection of Livelihood & Regulation) Act, 2014 .",no pledge,INC,2014,trn
865,We will expand the ASHA programme and appoint a second ASHA worker in all villages with a population exceeding 2500 persons .,pledge,INC,2019,trn
655,The Technology Development Board will be funded fully to support projects for commercialising indigenous R&D and public - private partnerships in key areas .,no pledge,INC,1999,trn
371,"To a large extent, deregulation, removal of laws that have outlived their utility or have not fulfilled their social purpose, transparency in party financing and state funding of elections will help .",no pledge,INC,2004,trn
315,"An initial set of identified schemes will be implemented, with public participation, by 2015 .",no pledge,BJP,2004,trn
553,The rapid expansion of infrastructure that India desperately needs requires the mobilisation of long - term finances .,no pledge,INC,1999,trn
984,We will significantly strengthen the National Clean Air Programme in order to urgently tackle the problem of pollution .,no pledge,INC,2019,trn
397,"Industry shall be persuaded to play a greater role than at present to prepare skilled manpower, which will be of mutual benefit .",no pledge,BJP,2009,trn
