text_id,text,label,metadata__party,metadata__year,metadata__split
540,"We will initiate a ‘Van Bandhu Kalyan Yojana’ at the national level, to be overseen by a ‘Tribal Development Authority’ .",pledge,BJP,2009,trn
256,The speed of constructing rural roads has doubled and 90% of rural road connectivity has been achieved .,no pledge,BJP,2019,trn
372,"To be implemented in all the nearly two hundred plus handloom clusters in the country, it will have five growth objectives :",pledge,BJP,2004,trn
401,"This Commission and the National Commission for Scheduled Castes will be equipped with administrative, judicial and financial powers .",pledge,INC,1999,trn
133,"On this count also, the people of India must reject the BJP .",no pledge,INC,2004,trn
192,BJP aims to nurture a Digital India - making every household and every individual digitally empowered .,no pledge,BJP,2014,trn
685,We will ensure appropriate electoral reforms to make the political process more transparent and accountable .,no pledge,INC,2014,trn
355,New coal mining projects will be started in 2004 to enhance existing capacity by 50 million tonnes .,pledge,BJP,2004,trn
275,"Therefore, the Congress will consolidate and rationalise existing poverty alleviation programmes to reduce administrative costs and substantially enhance the funding of anti - poverty and rural development programmes .",pledge,INC,1999,trn
115,We will provide fiscal incentives to businesses that employ a certain percentage of women .,no pledge,INC,2019,trn
415,We will convert the National Clean Air Plan into a Mission and we will focus on 102 most polluted cities in the country .,pledge,BJP,2019,trn
61,"With this in mind, we will remove bottlenecks and missing links in all sectors, activities and services .",no pledge,BJP,2014,trn
34,"The BJP was intent on exploding the nuclear bomb, without adequate preparation or study of its consequences .",no pledge,INC,1999,trn
628,The reach of insurance will be considerably enhanced in the next five years .,no pledge,BJP,2004,trn
383,"Congress promises a comprehensive review of the concept, role and functions of Public Sector Banks (PSBs) in order to make PSBs robust and competitive with healthy balance sheets .",no pledge,INC,2019,trn
314,"The River - Linking Project will be launched before August 15, 2004 .",no pledge,BJP,2004,trn
123,The epicentre of the scams lay in cooperative banks based in the constituencies of the Prime Minister and the Deputy Prime Minister .,no pledge,INC,2004,trn
412,"BJP will : Provide financial support, exploring ideas like additional tax benefits and higher interest rates .",no pledge,BJP,2014,trn
735,To do this we will amongst others : Prioritize all our resources towards this goal .,no pledge,BJP,2014,trn
216,"This is a source of embarrassment and discontent among the youth, especially young women .",no pledge,BJP,2004,trn
251,The Congress believes in affirmative action for all religious and linguistic minorities .,no pledge,INC,2004,trn
711,"Tourism will be promoted ; tribal welfare and rights will receive full attention ; and, infrastructure and coastal area development will be given top priority .",no pledge,BJP,2009,trn
525,"Instead of pursuing identity politics which do not fetch benefits to Dalits, OBCs and other deprived sections of our society, the BJP will focus on tangible development and empowerment .",no pledge,BJP,2009,trn
141,These policies have never been reduced by rote to a mindless doctrine or empty dogma or simplistic mantra .,no pledge,INC,2004,trn
102,We will also ensure price stability by all appropriate means and necessary legislation .,no pledge,BJP,1999,trn
332,The Congress will make the National Security Council a professional and effective institution .,no pledge,INC,2004,trn
680,The growth of entrepreneurship in the country advances in technology and the pressing demands on public expenditure from more essential sectors like education and health make such a reorientation essential .,no pledge,INC,1999,trn
236,A separate fund for improvement of all the Inter - State Bus Terminals and District Bus Stations will also be set up .,pledge,BJP,2004,trn
401,"We promise to take hard measures to prevent fraud in the banking, securities and financial markets (including money collection schemes) and deliver swift and deterrent punishment to offenders .",no pledge,INC,2019,trn
5,"In 2004, NDA left the Government with a near double digit growth .",no pledge,BJP,2014,trn
751,Every village will be connected through all - weather roads .,pledge,BJP,2014,trn
518,The procedures for overseas investments by Indian firms for acquisitions will be further liberalised .,no pledge,INC,1999,trn
184,"When compared to base year of 2015 - 16, GST revenue for all states have increased by 50% in three years .",no pledge,BJP,2019,trn
263,"Hence, the 4 drivers of economic growth are important and the Congress wishes to state its position on each of these :",no pledge,INC,2019,trn
773,10 . Protecting Indians overseas from exploitation or threats will remain a paramount concern of the Indian National Congress .,no pledge,INC,2014,trn
516,"Northern States, and in other areas where SHGs are still weak and fewer in number, will be specially targeted .",pledge,BJP,2004,trn
214,The recommendations of the Commission shall be ordinarily binding on the government .,pledge,INC,2019,trn
156,"It also means that whatever is in the interest of India will be in the interest of all the elements that India is made up of, including its citizens .",no pledge,BJP,2014,trn
258,"A viable crop insurance scheme for farmers, particularly in vulnerable regions will be introduced .",pledge,INC,1999,trn
290,We want to become a world leader in e - mobility .,no pledge,BJP,2019,trn
265,The Prime Minister’s 15 - point programme was launched in June 2006 with physical and financial targets for minorities in all welfare programmes of the Central Government .,no pledge,INC,2009,trn
707,"For the first time in decades, pendency of cases has begun to come down even as new filings have been going up .",no pledge,INC,2014,trn
548,"Recommendations of the Second Labor Commission will be implemented with necessary modifications to further strengthen welfare, training, and employment creation provisions .",no pledge,BJP,2004,trn
715,"Support for programs like ‘Swavalamban’ and STEP (Support to Training and Employment Program for Women), which promote self - employment and entrepreneurship for needy women, will be greatly enhanced .",no pledge,BJP,2004,trn
108,"India, the land of multiple identities and of multiple diversities faces many challenges to her political unity .",no pledge,INC,1999,trn
848,Our science and technology policy will be framed and implemented so as to be in harmony with our worldview of the large human family .,no pledge,BJP,2014,trn
67,Do we choose prosperity for all or wealth for a few ?,no pledge,INC,2019,trn
768,We will withdraw immediately the widely resented Citizenship Amendment Bill introduced by the BJP Government against the wishes of the people of the NES .,pledge,INC,2019,trn
254,"Getting well paying, decent jobs or entrepreneurship opportunities as they enter working age, is their number one priority .",no pledge,INC,2014,trn
196,"This is particularly so in regions which are well endowed but have not realised their full potential on account of institutional, infrastructural and technological constraints .",no pledge,INC,1999,trn
178,"Cultivation of medicinal plants and aromatic plants, which have considerable export potential, will be further promoted .",no pledge,BJP,2004,trn
275,"The Indian National Congress will extend social security to the entire labour class, both organised and unorganised .",no pledge,INC,2014,trn
565,"Ensure disabled - friendly access to public utilities, public buildings, and transport .",no pledge,BJP,2009,trn
447,Schemes for distributing assets like house sites and land jointly or singly in the name of women will be introduced .,pledge,INC,1999,trn
747,One of the first achievements of the first Indian National Congress - led UPA government was the creation of the Department of Ex - Servicemen’s Welfare .,no pledge,INC,2014,trn
410,"The Congress is asking the people of India to vote for it on the strength of the Congress's contributions, its commitments, its concerns and its charter .",no pledge,INC,2004,trn
291,"Panchayat bodies that got Constitutional sanction a decade ago because of the vision and relentless zeal of Rajiv Gandhi, now need full devolution of funds, functions and functionaries .",no pledge,INC,2004,trn
700,45 Work towards increasing the number of childcare facilities threefold .,no pledge,BJP,2019,trn
274,"This multiplicity of schemes needlessly adds to overheads, fractionates and sometimes duplicates the effort, and significantly reduces the share of anti - poverty funds actually reaching the intended beneficiaries .",no pledge,INC,1999,trn
332,Tuition fees and maintenance allowance to every Schedule Cast and Schedule Tribe student admitted to any university will be guaranteed for a maximum period of six years .,pledge,INC,1999,trn
829,The Congress will improve the functioning of the Committee system in Parliament .,no pledge,INC,1999,trn
103,He has presided over shocking security lapses in the nation's capital and elsewhere .,no pledge,INC,2004,trn
152,b . We will scale up skill development and training to open up new opportunities for upward economic mobility for our people .,no pledge,INC,2014,trn
418,"Over 140 lakh Indians depend, directly or indirectly, on fishing as a source of livelihood .",no pledge,INC,2019,trn
135,Sensitive States of the northeast and Jammu and Kashmir have benefited enormously and are seeing development activities on a very large scale .,no pledge,INC,2009,trn
342,Launching a training programme for trade unions to play an effective and positive role .,pledge,BJP,2009,trn
16,"This positive development is pregnant with possibilities not only for India and Pakistan, but also for the future of South Asia .",no pledge,BJP,2004,trn
516,The agro - prooessing industry will be given a special boost through appropriate fiscal technological and investment policies .,no pledge,INC,1999,trn
691,The NDA years saw the Union Government actively pushing a development agenda for the north - eastern States .,no pledge,BJP,2009,trn
661,6 . We will work to establish a Rapidly Deployable Multi - Protocol Wireless Communication system ; interoperable across all the services engaged in disaster management .,pledge,INC,2014,trn
171,"Public investment in agriculture and infrastructure, which has increased appreciably over the past five years, will be stepped up further .",pledge,INC,2009,trn
998,Necessary legal framework will be created to protect and promote cow and its progeny .,pledge,BJP,2014,trn
191,"When the Congress was in power during 1991 - 96, an estimated 70 lakh jobs were generated annually .",no pledge,INC,1999,trn
654,They will be duly empowered to take whatever steps are necessary to achieve their goals .,no pledge,BJP,2009,trn
114,"As in other programmes, the emphasis will be on the benefit to the poor and the deprived .",no pledge,BJP,1999,trn
153,"We will facilitate farming of sea - weed, pearl as well as ornamental fish to ensure a better return to the fishermen .",no pledge,BJP,2019,trn
332,We cherish the depth and vibrancy that the diversity in Indian society adds to the nation .,no pledge,BJP,2014,trn
61,"Rajniti Se Lok Niti, Gram Sabha Se Lok Sabha remains its objective .",no pledge,INC,2004,trn
943,"BJP will : Study in detail India's nuclear doctrine, and revise and update it, to make it relevant to challenges of current times .",no pledge,BJP,2014,trn
107,We will make all efforts to achieve this goal by 2022 .,pledge,BJP,2019,trn
243,"Similarly, places of cultural importance will be developed while maintaining their unique heritage .",no pledge,BJP,2019,trn
842,set an institute of Big data and Analytics for studying the impact of big data across sectors for predictive science .,pledge,BJP,2014,trn
627,The Court of Appeal will sit in multiple Benches of 3 judges each in 6 locations .,pledge,INC,2019,trn
192,"We are committed to ensuring that India is full and equal partner in its global progress ; indeed, that India can be a software super power .",no pledge,BJP,1999,trn
695,Haphazard growth in the past has had deleterious social and ecological consequences .,no pledge,INC,1999,trn
107,India is one nation but comprises of diversity and plural culture .,no pledge,INC,1999,trn
322,"This will lay particular emphasis on the modernization of urban transport, water supply and sanitation and control of pollution .",pledge,INC,2004,trn
813,"The NDA Government will work for effective financial and administrative empowerment of Panchayati Raj Institutions and Urban Local Bodies in respect of three Fs : ‘Funds’, ‘Functions’, and ‘Functionaries’ .",pledge,BJP,2004,trn
253,Monetary policy is the province of the Reserve Bank of India .,no pledge,INC,2019,trn
743,2 . India has emerged as one of the world’s largest importers of defence equipment ; it is thus imperative to encourage indigenous manufacturing in every way .,no pledge,INC,2014,trn
931,"The Congress has always sought and will continue to seek closer political, economic, cultural, educational, scientific and technological ties with the United States .",no pledge,INC,1999,trn
913,It will launch a new initiative for the integrated development of the Himalayan river system .,pledge,INC,1999,trn
132,d . Our vision is building India as the world leader in manufacturing .,no pledge,INC,2014,trn
159,Production of ethanol and power through co - generation plants will be stepped up .,pledge,BJP,2004,trn
323,Municipal administration will be revived and made financially self - sustaining .,pledge,INC,2004,trn
293,The Congress will ensure that all funds for poverty alleviation and rural development programmes will be credited directly to panchayat bodies .,pledge,INC,2004,trn
149,"It constitutes of all the communities - ethnic, social and cultural groups and also our culture, which is defined by tolerance and co - existence .",no pledge,BJP,2014,trn
16,Do we choose prosperity for all or wealth for a few ?,no pledge,INC,2019,trn
190,We have to create a hundred lakh jobs a year and aim at every family having at least one of its members in regular employment .,pledge,INC,1999,trn
599,"With a focussed effort on promotion of Sanskrit, we will ensure that the teaching of Sanskrit is expanded and popularised at the school level .",no pledge,BJP,2019,trn
24,We believe in a simple universal truth : equity and opportunity for all .,no pledge,INC,2014,trn
658,"The vision is to transform governance and service delivery in areas such as health, education and agriculture, and unleash local innovation capacity .",no pledge,INC,2014,trn
396,Interest rates must be such so as to stimulate not just investments but also provide adequate returns to savers .,no pledge,INC,2004,trn
723,67 Ensure the completion of six Tribal Freedom Fighters Museums .,no pledge,BJP,2019,trn
375,"Upgrade existing urban centres, transitioning focus from basic infrastructure to public utility services like Waste and Water Management - for a clean and healthy city life .",no pledge,BJP,2014,trn
75,We will examine and take time - bound steps to link Ganga - Cauvery Rivers .,pledge,BJP,1999,trn
94,"A Digital Security Agency will be set up to deal with cyber warfare, cyber counter - terrorism, and cyber security of national digital assets .",pledge,BJP,2009,trn
263,It will provide raw diamonds to the cutting and polishing units and bank them for future trade .,no pledge,BJP,2009,trn
355,"It will usher in an era of simplicity, transparency, tax equity, easy compliance and impartial administration .",pledge,INC,2019,trn
307,"There are, however, major state - level variations which must be taken into account in formulating population policy .",no pledge,INC,1999,trn
129,a . We will ensure that India has a globally competitive business and investment friendly environment .,no pledge,INC,2014,trn
589,"6 . We will give a new thrust to new and renewable energy, including hydel, solar and nuclear energy .",no pledge,INC,2014,trn
48,"There is also the so - called Third Front, a grouping of opportunistic parties .",no pledge,INC,2009,trn
779,Convert all unmanned crossings into manned crossings in a phased manner .,pledge,BJP,2014,trn
379,The end of the Multi - Fibre Agreement and the quota regime in 2005 presents an opportunity to India’s textile industry .,no pledge,BJP,2004,trn
417,"The Congress will strictly implement the identification, release and rehabilitation programme for bonded labour .",no pledge,INC,1999,trn
465,"Our flagship and historic programme, the Mahatma Gandhi National Rural Employment Guarantee Act (MGNREGA) has been a significant contributor in this ;",no pledge,INC,2014,trn
781,"On the one side is the Indian National Congress, which celebrates and rejoices in the multitude of diversities of India .",no pledge,INC,2014,trn
21,The much - publicised National Rural Employment Guarantee Programme has turned out to be as much a flop as all other schemes of the Government .,no pledge,BJP,2009,trn
476,We will set up more branches of the Bharatiya Mahila Bank and women only branches of other public sector banks .,pledge,INC,2014,trn
569,"Never before have the institutions that underpin a parliamentary democracy been so brazenly undermined, denigrated and captured as in the last 5 years .",no pledge,INC,2019,trn
162,"Grameen Vikas, to improve the income and welfare of kisans and khet mazdoors across the country ;",pledge,INC,2004,trn
436,set up neighbourhood Children's/ Youth Parliament across India that leads to vibrant student committees .,pledge,BJP,2014,trn
924,We will pay special attention to them and ensure that food grains are delivered to them through mobile fair price shops .,no pledge,INC,2019,trn
65,It was Rajiv Gandhi who declared Swami Vivekananda's birth anniversary on January 12th as National Youth Day .,no pledge,INC,2004,trn
237,"While consolidating on the announcements and progress made over the last year, we commit to implementing the following agenda within 100 days of forming the next government :",no pledge,INC,2014,trn
919,Congress will pass a Students Rights Bill to codify the rights and obligations of students in colleges and universities .,pledge,INC,2019,trn
31,"harness the opportunities provided by the upgradation of infrastructure and housing, for its job generating potential .",no pledge,BJP,2014,trn
949,"BJP believes that political stability, progress and peace in the region are essential for south Asia's growth and development .",no pledge,BJP,2014,trn
579,The University Grants Commission is redesigning college curriculum to enable students to have greater flexibility in the choice of subjects and pursue multiple job - oriented diploma courses simultaneously .,no pledge,BJP,2004,trn
183,we will generate 'Kartavya Bhavna' among public servants as lives and productivity of people is dependent on the quality and efficiency of public services .,no pledge,BJP,2014,trn
478,We have given due emphasis to on - line courses as a medium of delivering education in the last five years .,no pledge,BJP,2019,trn
493,"The BJP remains committed to 33 per cent political representation for women, and shall act on this after coming to power .",pledge,BJP,2009,trn
814,Give a thrust to renewable sources of energy as an important component of India's energy mix .,no pledge,BJP,2014,trn
428,BJP considers youth as the most productive asset of the nation who have played a key role in taking the country to a near double digit growth .,no pledge,BJP,2014,trn
159,We have also shown that our desire for peace and friendship should not be interpreted as weakness but as a firm resolve that aggression shall not be permitted to succeed .,no pledge,BJP,1999,trn
288,All airports in the country will be brought under the framework of public - private partnerships .,pledge,BJP,2004,trn
572,Categorisation of communities as ‘minorities’ perpetuates notions of imagined discrimination and victimhood ; it reinforces the perception of the ‘minority’ identity as separate from the national identity .,no pledge,BJP,2009,trn
312,Congress promises to devise a rehabilitation plan for MSMEs that were severely affected and help them revive and grow .,no pledge,INC,2019,trn
170,"An action plan for massive crop diversification, multicropping, and doubling per - acre yields of all crops will be prepared .",pledge,BJP,2004,trn
644,"They will be given flexibility, freedom of operation and financial autonomy .",no pledge,INC,1999,trn
80,The misuse of religion to incite popular passions to ignite mutual antagonisms is communalism .,no pledge,INC,2004,trn
296,"3 . The Indian National Congress will expand the Rashtriya Swasthya Bima Yojana to enable access to a continuum of comprehensive primary, secondary and tertiary care .",pledge,INC,2014,trn
88,"We would also assert more robustly India’s national interests, especially at the forthcoming review conference of the WTO, scheduled for November 1999 .",no pledge,BJP,1999,trn
288,The Indian National Congress will bring school curricula of various communal and sectarian organizations — regardless of their affiliation —under the regulatory purview of an empowered national body .,pledge,INC,2009,trn
386,A separate and dedicated Ministry of Minority Affairs was established under the Congress - led UPA - I government .,no pledge,INC,2014,trn
300,"In the event of loss of crops, farmers will be compensated under this scheme so that they do not suffer any loss of income .",no pledge,BJP,2009,trn
46,"Instinctively, the Indian National Congress unites, while the BJP divides .",no pledge,INC,2009,trn
859,"Congress promises to increase the number of doctors, including specialist doctors, significantly by establishing more medical colleges, increasing the capacity of medical colleges and providing scholarships and loans to medical students .",pledge,INC,2019,trn
218,"Special infrastructure facilities for substantially expanding international and domestic tourism, and thus realising the full employment potential of this sector, will be given high priority .",no pledge,INC,1999,trn
489,The Indian National Congress has instituted schemes like the Rashtriya Krishi Vikas Yojana .,no pledge,INC,2014,trn
219,"Third, with an additional 55 million people pushed below the poverty line over the last five years, there is widespread malnourishment .",no pledge,BJP,2009,trn
902,We promise to give a six - monthly report on the status of implementation of the commitments made in this Agenda .,pledge,BJP,2004,trn
564,3 . The Indian National Congress will ensure that all million - plus cities are covered by High Speed Rail .,pledge,INC,2014,trn
421,4 . We will establish an independent regulatory mechanism to oversee State and private institutions to ensure standardisation and quality of education .,pledge,INC,2014,trn
333,"SEB losses to be reduced to less than Rs . 5,000 crore by 2009 from the current figure of Rs . 24,000 crore .",pledge,BJP,2004,trn
634,"We will effectively pursue co - operation against global evils, such as terrorism and corruption through forums like UN, the G20, BRICS, SCO, Commonwealth, etc .",no pledge,BJP,2019,trn
810,"We will immediately repeal the Habitual Offenders Act, 1952 that has discriminated against and stigmatised Denotified and Semi - Nomadic Tribes and led to their harassment .",pledge,INC,2019,trn
249,Congress promises to reverse the BJP Government’s fiddling with the target of fiscal deficit .,pledge,INC,2019,trn
947,The ASER Report is an indictment of the quality of instruction in many schools .,no pledge,INC,2019,trn
39,We built the public sector that was the foundation upon which industrialisation and technological progress reached commanding heights .,no pledge,INC,2019,trn
974,"Guiding Principles of our Foreign Policy will be : Equations will be mended through pragmatism and a doctrine of mutually beneficial and interlocking relationships, based on enlightened national interest .",no pledge,BJP,2014,trn
870,"Schools, colleges and universities shall be, mostly, public institutions funded through public resources .",no pledge,INC,2019,trn
665,We will give special tax incentives for setting up manufacturing for such products in India .,pledge,INC,2014,trn
300,"The BJP is committed to bridge the gap, following the principles of Samajik Nyay (social justice) and Samajik Samrasata (social harmony) .",no pledge,BJP,2014,trn
683,Overall goal is to enhance the competitiveness of the SME sector leading to a larger contribution to our economic growth and employment generation .,no pledge,BJP,2014,trn
254,"The last five years, under the leadership of Prime Minister Modi, infrastructural roll out has been put back on track .",no pledge,BJP,2019,trn
614,States will be given incentives to switch over to VAT .,no pledge,BJP,2004,trn
202,The flow of agricultural credit would be doubled in the next three years and the coverage of small and marginal farmers by institutional lending will also expand substantially .,pledge,INC,2004,trn
342,"Congress will appoint an independent panel of eminent economists, social scientists and statisticians to oversee the design, testing, rollout and implementation of the programme .",pledge,INC,2019,trn
315,The capacity of the traditional bureaucracy to deliver on our economic goals has been inadequate .,no pledge,INC,2019,trn
559,Review existing provisions of old age pension scheme and expand its application .,no pledge,BJP,2009,trn
688,"The ‘Janani Suraksha Yojana,’ already envisaged by us, will be implemented with the aim of establishing linkages between a health center and the mother - to - be .",pledge,BJP,2004,trn
